"Day","Event description","Event type","News link","News full text","Entities (conf>0.6)","# distinct entities"
"2014-07-17","Malaysia Airlines Flight 17 carrying 298 people from multiple countries is shot down near Hrabove in Donetsk Oblast, on a flight from Amsterdam to Kuala Lumpur. (BBC) (Reuters)","armed conflicts and attacks","http://www.bbc.com/news/world-europe-28354856","Malaysia jet crashes in east Ukraine conflict zone
A Malaysia Airlines jet carrying 295 people has crashed in east Ukraine on a flight from Amsterdam to Kuala Lumpur.
There are no signs of survivors at the scene of the crash near the village of Grabovo, in rebel-held territory close to the border with Russia.
Both sides in Ukraine's civil conflict accused each other of shooting down the plane with a missile. It is still not clear why the plane came down.
It is the second disaster suffered by Malaysia Airlines this year.
Flight MH370 disappeared en route from Malaysia to China in March and still has not been found.
At a news conference at Schiphol airport, Malaysia Airlines' European chief Huib Gorter said they were still trying to identify some of the passengers from flight MH17.
He said of the passengers that have been identified there were:
Other airlines have announced they are now avoiding eastern Ukraine.
If it does turn out that the Boeing 777 was shot down by the separatists - with weaponry supplied by Moscow - then it could significantly alter the terms of the whole debate surrounding the Ukraine crisis.
Over the past few days there has been growing concern among Western governments that Russia was stepping up its military support for the separatists in eastern Ukraine.
Nato spokesmen insist that more and more heavy military equipment has moved from Russian stockpiles to the separatists across the border.
In response, the United States has strengthened its economic sanctions against Moscow - it is threatening even stronger action - though the European Union has so far failed to follow Washington's lead.
But if Russia in any way had a hand in this tragedy then the pressure - especially on the Europeans - for much tougher sanctions will only grow.
Malaysian Prime Minister Najib Razak spoke of his shock and said he was launching an immediate inquiry into the crash.
""This is a tragic day in what has already been a tragic year for Malaysia,"" he said.
US and Ukrainian officials said they believed the plane had been brought down by a missile.
Ukrainian President Petro Poroshenko said it was an ""act of terrorism"".
Foreign Minister Pavlo Klimkin told the BBC he had intercepted phone conversations that proved the plane was shot down by pro-Russian separatists.
But Russian President Vladimir Putin blamed the Ukraine government for restarting military operations in the area, where it is trying to regain control from pro-Russian rebels.
""The country in whose airspace this happened bears responsibility for it,"" he said.
Separatist leader Alexander Borodai accused the Ukrainian government of downing the airliner.
Ukraine's defence ministry issued a statement saying there were no air force jets in the area and no surface-to-air systems being used against the rebels.
The British government has called for an emergency meeting of the UN Security Council to discuss the crisis in Ukraine as a result of the crash.
The plane fell between Krasni Luch in Luhansk region and Shakhtarsk in the neighbouring region of Donetsk.
At least 100 bodies have been found so far at the scene, an emergency services worker told Reuters news agency, with wreckage spread across an area of up to about 15km (nine miles) in diameter.
Broken pieces of the wings were marked with the blue and red paint of Malaysian Airlines.
""I was working in the field on my tractor when I heard the sound of a plane and then a bang and shots,"" a witness called Vladimir told Reuters.
""Then I saw the plane hit the ground and break in two. There was thick black smoke.""
A separatist rebel from nearby Krasnyi Luch who gave his name as Sergei said: ""From my balcony I saw a plane begin to descend from a great height and then heard two explosions.""
The head of the Russian Air Traffic Controllers' Union, Sergei Kovalyov, told BBC Russian that the airspace over eastern Ukraine had remained open during the conflict because the planes previously shot down had tended to be helicopters or low-flying fast jets.
""In order to bring down an airplane from an altitude of 10,000m, you need to have very serious weapons…. missiles,"" he said. ""It's either a mistake or a terrorist act.""
Ukraine has accused Russia's military of supplying advanced missiles to the rebels.
Earlier on Thursday, Ukrainian officials blamed the Russian air force for shooting down one of its ground attack jets on Wednesday, and a transport plane on Monday.
In 2001, Ukraine admitted its military was probably responsible for shooting down a Russian airliner that crashed into the Black Sea, killing all 78 people on board.","Ukraine (occ: 7.0 conf: 0.7927142857142856):
C: Ukraine, 1991 establishments in Ukraine, Areas of traditional spread of Ukrainians and Ukrainian language, Countries in Europe, Eastern Europe, Kievan Rus', Member states of the Council of Europe, Member states of the United Nations, Republics, Slavic countries and territories, States and territories established in 1991, Ukrainian-speaking countries and territories
T: Country, PopulatedPlace, Place, Location

Jet_aircraft (occ: 5.0 conf: 0.65876):
C: Jet aircraft

Separatism (occ: 5.0 conf: 0.6859599999999999):
C: Political theories, Politics and race, Religion and politics, Independence movements, Secession, Segregation, Separatism, Nationalism

Eastern_Ukraine (occ: 4.0 conf: 0.72075):
C: Regions of Ukraine

Malaysia_Airlines (occ: 4.0 conf: 0.8274750000000001):
C: Malaysia Airlines, Airlines established in 1947, Airlines of Malaysia, Association of Asia Pacific Airlines, Government-owned airlines, Government-owned companies of Malaysia, IATA members, Kuala Lumpur International Airport, Malaysian brands, 1947 establishments in Malaya
T: Airline, Company, Organisation, Agent

Missile (occ: 4.0 conf: 0.621375):
C: Missiles, Missile types, Rockets and missiles, Ammunition, Explosive weapons

Russians (occ: 4.0 conf: 0.649525):
C: Russian people, Ethnic groups in Asia, Ethnic groups in Azerbaijan, Ethnic groups in Crimea, Ethnic groups in Dagestan, Ethnic groups in Europe, Ethnic groups in Georgia (country), Ethnic groups in Kazakhstan, Ethnic groups in Kyrgyzstan, Ethnic groups in Latvia, Ethnic groups in Russia, Ethnic groups in Tajikistan, Ethnic groups in Turkmenistan, Ethnic groups in Ukraine, Ethnic groups in Uzbekistan, Slavic ethnic groups
T: EthnicGroup

Russia (occ: 2.0 conf: 0.8351999999999999):
C: Russia, BRICS nations, Caspian littoral states, Central Asian countries, Countries in Europe, East Asian countries, Eastern Europe, Federal republics, G8 nations, G20 nations, Member states of the Commonwealth of Independent States, Member states of the Council of Europe, Member states of the United Nations, North Asian countries, Northeast Asian countries, Russian-speaking countries and territories, Slavic countries and territories, States and territories established in 862, Western Asian countries, E7 nations
T: Country, PopulatedPlace, Place, Location

European_Union (occ: 2.0 conf: 0.7180500000000001):
C: European Union, 1993 establishments in Europe, Confederations, G20 nations, G7 nations, G8 nations, International organizations of Europe, Organizations awarded Nobel Peace Prizes, Organizations established in 1993, Political systems, Supranational unions, Trade blocs, United Nations General Assembly observers, Articles containing video clips
T: Country, PopulatedPlace, Place, Location

Moscow (occ: 2.0 conf: 0.7861):
C: Moscow, Moscow Governorate, 1147 establishments in Russia, Capitals in Europe
T: AdministrativeRegion, <http://purl.org/dc/terms/Jurisdiction>, Region, PopulatedPlace, Place, Location

Ukrainian_crisis (occ: 2.0 conf: 0.77285):
C: Ukrainian crisis, Conflicts in Ukraine, Ongoing conflicts, 2010s in Ukraine, 2010s conflicts, History of Ukraine since 1991, Political history of Ukraine, Post-Soviet conflicts, Russia–Ukraine relations, Articles containing video clips

Malaysia (occ: 2.0 conf: 0.64465):
C: Malaysia, Commonwealth monarchies, Developing 8 Countries member states, Federal monarchies, Former British colonies, G15 nations, Malay-speaking countries and territories, Member states of the Association of Southeast Asian Nations, Member states of the Commonwealth of Nations, Member states of the Organisation of Islamic Cooperation, Member states of the United Nations, Southeast Asian countries, States and territories established in 1963, World War II sites, Muslim-majority countries
T: Country, PopulatedPlace, Place, Location

Terrorism (occ: 2.0 conf: 0.7003999999999999):
C: Terrorism, Fear, Abuse, War on Terror, Organized crime, Violent crime

BBC (occ: 2.0 conf: 0.7746):
C: BBC, Radio in the United Kingdom, BBC Radio, Publicly funded broadcasters, Companies based in London, Companies established in 1927, 1927 establishments in the United Kingdom, European Broadcasting Union members, Multilingual broadcasters, British brands, Public corporations of the United Kingdom with a Royal Charter, Department for Culture, Media and Sport, Peabody Award winners, Government-owned companies of the United Kingdom
T: Company, Organisation, Agent

Ukrainian_Soviet_Socialist_Republic (occ: 2.0 conf: 0.85285):
C: Ukrainian Soviet Socialist Republic, Republics of the Soviet Union, Communism in Ukraine, Communist states, History of Ukraine (1918–91), Modern history of Ukraine, Eastern Bloc, Former countries in Europe, Former member states of the United Nations, Former Slavic countries, Former socialist republics, Post–Russian Empire states, Russian Revolution in Ukraine, Russian-speaking countries and territories, Ukrainian-speaking countries and territories, 1917 establishments in Ukraine, 1991 disestablishments in Ukraine, States and territories established in 1917, States and territories disestablished in 1991, 20th century in Ukraine, Soviet Union–Ukraine relations
T: Country, PopulatedPlace, Place, Location

Airspace (occ: 2.0 conf: 0.6951499999999999):
C: Air traffic control, General aviation

Airliner (occ: 2.0 conf: 0.7198500000000001):
C: Airliners, Russian inventions

Reuters (occ: 2.0 conf: 0.79705):
C: Reuters, Companies established in 1851, Media companies based in London, Multilingual news services, News agencies based in the United Kingdom, Financial news agencies, 1851 establishments in the United Kingdom, Webby Award winners
T: Company, Organisation, Agent

Amsterdam (occ: 1.0 conf: 0.7907):
C: Amsterdam, Capitals in Europe, Cities in the Netherlands, Municipalities of North Holland, Olympic cycling venues, Populated places established in the 13th century, Populated places in North Holland, Port cities and towns in the Netherlands, Port cities and towns of the North Sea, 1928 Summer Olympic venues
T: City, Settlement, PopulatedPlace, Place, Location

Kuala_Lumpur (occ: 1.0 conf: 0.8664):
C: Kuala Lumpur, Capital districts and territories, Capitals in Asia, Federal Territories in Malaysia, Klang Valley, Populated places established in 1857
T: Settlement, PopulatedPlace, Place, Location

Hrabove%2C_Donetsk_Oblast (occ: 1.0 conf: 0.8869):
C: Villages in Donetsk Oblast, Don Host Oblast, Malaysia Airlines Flight 17
T: Village, Settlement, PopulatedPlace, Place, Location

Civil_war (occ: 1.0 conf: 0.7016):
C: Civil wars, Wars by type

Natural_disaster (occ: 1.0 conf: 0.6329):
C: Natural disasters

Malaysia_Airlines_Flight_370 (occ: 1.0 conf: 0.7499):
C: Malaysia Airlines Flight 370, 2014 in Australia, 2014 disasters in China, 2014 in international relations, 2014 in Malaysia, Accidents and incidents involving the Boeing 777, Airliner accidents and incidents with an unknown cause, Articles containing video clips, Australia–China relations, Australia–Malaysia relations, Aviation accidents and incidents in 2014, Aviation accidents and incidents in international airspace, Aviation accidents and incidents in Malaysia, China–Malaysia relations, History of the Indian Ocean, Malaysia Airlines accidents and incidents, Missing aircraft

China (occ: 1.0 conf: 0.7591):
C: China, Central Asian countries, Chinese-speaking countries and territories, Communist states, East Asian countries, G20 nations, Member states of the United Nations, Republics, One-party states, States and territories established in 1949, BRICS nations, E7 nations
T: Country, PopulatedPlace, Place, Location

Amsterdam_Airport_Schiphol (occ: 1.0 conf: 0.8292):
C: Airports established in 1916, Airports in North Holland, Transport in Amsterdam, Canon of Amsterdam, Haarlemmermeer
T: Airport, Infrastructure, ArchitecturalStructure, Place, Location

Malaysia_Airlines_Flight_17 (occ: 1.0 conf: 0.797):
C: Malaysia Airlines Flight 17, 2014 controversies, 2014 in international relations, 2014 in Malaysia, 2014 in the Netherlands, 2014 in Ukraine, Accidents and incidents involving the Boeing 777, Airliner shootdown incidents, Attacks in 2014, Aviation accidents and incidents in 2014, Aviation accidents and incidents in Ukraine, Donetsk People's Republic, History of Donetsk Oblast, Malaysia Airlines accidents and incidents, Malaysia–Netherlands relations, Malaysia–Ukraine relations, Netherlands–Ukraine relations, War in Donbass, 21st-century aircraft shootdown incidents, Articles containing video clips

Boeing_777 (occ: 1.0 conf: 0.89):
C: Boeing 777, United States airliners 1990–1999, Twinjets, Boeing aircraft
T: Aircraft, MeanOfTransportation

Western_world (occ: 1.0 conf: 0.6915):
C: Country classifications, Cultural concepts, Cultural spheres of influence, Eurocentrism, Western culture

Russian_Empire (occ: 1.0 conf: 0.84):
C: Russian Empire, Early Modern history of Russia, Modern history of Russia, Former Slavic countries, 18th century in Russia, 19th century in Russia, 20th century in Russia, 1721 establishments in Russia, 1917 disestablishments in Russia, Articles containing video clips
T: Country, PopulatedPlace, Place, Location

NATO (occ: 1.0 conf: 0.8435):
C: 1949 in military history, 20th-century military alliances, 21st-century military alliances, Anti-communist organizations, Cold War organizations, Cold War treaties, Foreign relations of the Soviet Union, International military organizations, Military alliances involving Belgium, Military alliances involving Bulgaria, Military alliances involving Canada, Military alliances involving Estonia, Military alliances involving France, Military alliances involving Greece, Military alliances involving Hungary, Military alliances involving Italy, Military alliances involving Latvia, Military alliances involving Lithuania, Military alliances involving Luxembourg, Military alliances involving Poland, Military alliances involving Portugal, Military alliances involving Romania, Military alliances involving Spain, Military alliances involving Turkey, Military alliances involving the Netherlands, Military alliances involving the United Kingdom, Military alliances involving the United States, Multiregional international organizations, NATO, Organisations based in Brussels, Organizations established in 1949, Supraorganizations
T: Organisation, Agent

United_States (occ: 1.0 conf: 0.7195):
C: United States, 1776 establishments in the United States, English-speaking countries and territories, Federal constitutional republics, Former British colonies, Former confederations, G7 nations, G8 nations, G20 nations, Liberal democracies, Member states of NATO, Member states of the United Nations, Republics, States and territories established in 1776, Superpowers
T: Country, PopulatedPlace, Place, Location

Economic_sanctions (occ: 1.0 conf: 0.7343):
C: Political economy, International sanctions, International trade

Prime_minister (occ: 1.0 conf: 0.6842):
C: Prime ministers, Heads of government, Legal professions, Titles, Government ministers, Positions of authority

Najib_Razak (occ: 1.0 conf: 0.8833):
C: 1953 births, Alumni of the University of Nottingham, Chief Ministers of Pahang, Deputy Prime Ministers of Malaysia, Living people, Malaysian people of Bugis descent, Malaysian Malay people, Malaysian Muslims, Malaysian politicians, Government ministers of Malaysia, Members of the Dewan Rakyat, Members of the Pahang State Legislative Assembly, People educated at Malvern College, People from Pahang, Prime Ministers of Malaysia, United Malays National Organisation politicians, Children of Prime Ministers of Malaysia, Leaders of political parties in Malaysia
T: OfficeHolder, Person, Agent

President_of_France (occ: 1.0 conf: 0.6781):
C: Presidents of France, Government of France

Petro_Poroshenko (occ: 1.0 conf: 0.9085):
C: 1965 births, Businesspeople in confectionery, Candidates for President of Ukraine (2014), Economic development and trade ministers of Ukraine, Foreign ministers of Ukraine, Grand Cross of the Order of Civil Merit, Independent politicians in Ukraine, Petro Poroshenko Bloc politicians, Living people, People from Bolhrad, People of the Euromaidan, People of the Orange Revolution, Presidents of Ukraine, Pro-Ukrainian people of the 2014 pro-Russian unrest in Ukraine, Recipients of the Order of Merit (Ukraine), 2nd class, Recipients of the Order of Merit (Ukraine), 3rd class, Social Democratic Party of Ukraine (united) politicians, Third convocation members of the Verkhovna Rada, Fourth convocation members of the Verkhovna Rada, Fifth convocation members of the Verkhovna Rada, Seventh convocation members of the Verkhovna Rada, Secretaries of National Security and Defense Council of Ukraine, Taras Shevchenko National University of Kyiv alumni, Ukrainian anti-communists, Ukrainian billionaires, Ukrainian manufacturing businesspeople, Ukrainian mass media owners, Members of Ukrainian Orthodox church bodies, Pro-Ukrainian people of the war in Donbass, Solidarity Party (Ukraine) politicians
T: OfficeHolder, Person, Agent

Ministry_of_Foreign_Affairs_%28Russia%29 (occ: 1.0 conf: 0.6847):
C: Federal Ministries of Russia, Foreign relations of Russia, Foreign affairs ministries, Arbat District
T: GovernmentAgency, Organisation, Agent

Pavlo_Klimkin (occ: 1.0 conf: 0.9065):
C: 1967 births, Ambassadors of Ukraine to Germany, Foreign ministers of Ukraine, Living people, Moscow Institute of Physics and Technology alumni, People from Kursk, Russian expatriates in Ukraine, Ukrainian diplomats
T: OfficeHolder, Person, Agent

2014_pro-Russian_unrest_in_Ukraine (occ: 1.0 conf: 0.7964):
C: 2014 pro-Russian unrest in Ukraine, 2014 in Russia, 2014 in Ukraine, Russians in Ukraine, Donbass, Ukrainian crisis, Riots and civil disorder in Ukraine, Russian nationalism in Ukraine, Russia–Ukraine relations, Secession in Ukraine, Articles containing video clips

President_of_Russia (occ: 1.0 conf: 0.816):
C: Presidents of Russia, Government of Russia, 1991 establishments in Russia

Vladimir_Putin (occ: 1.0 conf: 0.9322):
C: Vladimir Putin, 1952 births, Living people, 2003 Tuzla island conflict, Acting Presidents of Russia, Articles containing video clips, Confucius Peace Prize winners, Directors of the Federal Security Service, FSB officers, Grand Croix of the Légion d'honneur, Grand Crosses of the Order of St. Sava, Heads of government of the Russian Federation, Independent politicians, KGB officers, Kyokushin kaikan practitioners, Our Home – Russia politicians, People from Saint Petersburg, People of the annexation of Crimea by the Russian Federation, People of the Chechen wars, People of the Russo-Georgian War, Plagiarism controversies, Presidents of Russia, Recipients of the Order of Zayed, Russian judoka, Russian karateka, Russian Orthodox Christians from Russia, Russian sambo practitioners, Saint Petersburg State University alumni, United Russia politicians
T: OfficeHolder, Person, Agent

Government (occ: 1.0 conf: 0.6637):
C: Forms of government, Government, Government institutions, Political terminology

Russophilia (occ: 1.0 conf: 0.6664):
C: Russian nationalism, Russian culture, Foreign relations of Russia, Admiration of foreign cultures

Nation_state (occ: 1.0 conf: 0.71):
C: Nationalism, Political science terms

Adolf_Hitler (occ: 1.0 conf: 0.6118):
C: Adolf Hitler, 1889 births, 1945 deaths, 20th-century Austrian writers, 20th-century criminals, 20th-century German writers, 20th-century politicians, Austrian anti-communists, Austrian criminals, Austrian emigrants to Germany, Austrian Nazis who committed suicide, Austrian people of World War II, Chancellors of Germany, Conspiracy theorists, Fascist rulers, Flag designers, Former Roman Catholics, German anti-communists, German military leaders, German military personnel of World War I, German nationalists, German Nazi politicians, German people of Austrian descent, German people of World War II, German political writers, German politicians who committed suicide, German revolutionaries, Hitler family, Holocaust perpetrators, Jews and Judaism in Germany, Joint suicides by Nazis, Leaders of political parties in Germany, Members of the Reichstag of the Weimar Republic, Members of the Reichstag of Nazi Germany, Military personnel of Bavaria, Naturalized citizens of Germany, Nazi leaders, Nazism, Nazis who committed suicide by firearm in Germany, Nazis who committed suicide in Berlin, Nazis who participated in the Beer Hall Putsch, Nazis who served in World War I, People convicted of treason against Germany, People from Braunau am Inn, Persecution of LGBT people, Persecution of homosexuals in Nazi Germany and the Holocaust, Persecution of Serbs, Political writers who committed suicide, Porajmos perpetrators, Recipients of German pardons, Recipients of the Golden Party Badge, Recipients of the Iron Cross (1914), 1st class, Stateless people, Suicides by firearm in Germany, The Holocaust in Austria, The Holocaust in Germany, World War II political leaders, Articles containing video clips
T: OfficeHolder, Person, Agent

Alexander_Borodai (occ: 1.0 conf: 0.9093):
C: Living people, Pro-Russian people of the 2014 pro-Russian unrest in Ukraine, People from Moscow, Moscow State University alumni, 1972 births, Russian nationalists, People of the Donetsk People's Republic, Pro-Russian people of the war in Donbass
T: OfficeHolder, Person, Agent

Government_of_Ukraine (occ: 1.0 conf: 0.7455):
C: Government of Ukraine, National cabinets, European governments

Air_force (occ: 1.0 conf: 0.6615):
C: Air forces

Surface-to-air_missile (occ: 1.0 conf: 0.669):
C: Surface-to-air missiles, Anti-aircraft weapons, Missile types, Missiles

Government_of_the_United_Kingdom (occ: 1.0 conf: 0.7089):
C: Constitution of the United Kingdom, Executive branches of government, Government of the United Kingdom, Westminster system governments, European governments

Malayan_Emergency (occ: 1.0 conf: 0.6819):
C: Malayan Emergency, 1948 in military history, Cold War conflicts, Wars involving pre-independence Malaysia, Communism in Malaysia, Communism in Singapore, History of colonialism, History of the Royal Marines, Insurgencies in Asia, Resistance to the British Empire, Wars involving Australia, Cold War history of Australia, Wars involving Rhodesia, Wars of independence
T: MilitaryConflict, SocietalEvent, Event

United_Nations_Security_Council (occ: 1.0 conf: 0.8205):
C: United Nations Security Council, International security, Organizations established in 1946

Luhansk_Oblast (occ: 1.0 conf: 0.816):
C: Luhansk Oblast, Oblasts of Ukraine, States and territories established in 1938, Donbass

Shakhtarsk (occ: 1.0 conf: 0.8977):
C: Cities in Donetsk Oblast, Don Host Oblast, Cities and towns of Ukraine built in the Soviet Union, Cities of regional significance in Ukraine
T: City, Settlement, PopulatedPlace, Place, Location

Donetsk (occ: 1.0 conf: 0.8249):
C: Donetsk, Cities in Donetsk Oblast, Special economic zones, Populated places established in 1869, Mining cities and regions in Ukraine, Articles containing video clips, Cities of regional significance in Ukraine, Cities and towns of Ukraine built in the Russian Empire, 1869 establishments in Russia
T: City, Settlement, PopulatedPlace, Place, Location

Krasnyi_Luch (occ: 1.0 conf: 0.8808):
C: Cities in Luhansk Oblast, Russification, Cities of regional significance in Ukraine, Cities and towns of Ukraine built in the Russian Empire, City name changes in Ukraine
T: City, Settlement, PopulatedPlace, Place, Location

Air_traffic_controller (occ: 1.0 conf: 0.6414):
C: Air traffic control, Combat support occupations, Occupations in aviation, Aviation licenses and certifications

Sergei_Kovalev (occ: 1.0 conf: 0.8766):
C: 1930 births, Living people, People from Seredyna-Buda, Moscow State University alumni, Russian biophysicists, Soviet dissidents, Soviet human rights activists, Russian dissidents, Russian human rights activists, Russian political activists, Soviet prisoners and detainees, Amnesty International prisoners of conscience, Moscow Helsinki Group, Amnesty International people, Memorial (society), Ombudsmen in Russia, Democratic Choice of Russia politicians, Yabloko politicians, Members of the State Duma (Russian Federation), Olof Palme Prize laureates, Recipients of the Order of Tomáš Garrigue Masaryk, Recipients of Geuzenpenning, Recipients of the Order of the Cross of Terra Mariana, 3rd Class, Officiers of the Légion d'honneur, Grand Crosses of the Order of Merit of the Republic of Poland, Recipients of the Sakharov Prize, Russian political writers, 20th-century writers
T: Person, Agent

Helicopter (occ: 1.0 conf: 0.7023):
C: Helicopters, Aircraft configurations, Italian inventions, Articles containing video clips

Military (occ: 1.0 conf: 0.659):
C: Military, Military terminology, Defense

Russian_Air_Force (occ: 1.0 conf: 0.8954):
C: Russian Air Force, Military of Russia, Russian military aviation
T: MilitaryUnit, Organisation, Agent

Attack_aircraft (occ: 1.0 conf: 0.7279):
C: Fighter aircraft, Attack aircraft

Cargo_aircraft (occ: 1.0 conf: 0.6957):
C: Cargo aircraft, Military transport aircraft

Military_aircraft (occ: 1.0 conf: 0.6592):
C: Military aircraft

Black_Sea (occ: 1.0 conf: 0.8591):
C: Black Sea, Anoxic waters, Back-arc basins, Bulgaria–Romania border, Bulgaria–Turkey border, European seas, Georgia (country)–Russia border, Georgia (country)–Turkey border, Bodies of water of Bulgaria, Bodies of water of Georgia (country), Bodies of water of Romania, Seas of Turkey, Romania–Ukraine border, Russia–Ukraine border, Seas of Russia, Seas of the Atlantic Ocean, Seas of the Mediterranean, Seas of Ukraine, World Digital Library related, Landforms of Crimea
T: Sea, BodyOfWater, NaturalPlace, Place, Location

","181"
