"Day","Event description","Event type","News link","News full text","Entities (conf>0.6)","# distinct entities"
"2014-06-26","Uruguay's star striker Luis Suárez is expelled from the tournament, banned for nine international matches and suspended from all football-related activity for four months for biting Giorgio Chiellini of Italy in Tuesday's Group D match. The verdict, the most severe against any player in FIFA World Cup history, means Suárez will be unable to play or train for his club Liverpool until 27 October. (Press Association) (BBC Sport)","sport","http://www.bbc.com/sport/0/football/28023882","Luis Suarez bite: Uruguay striker banned for four months
Uruguay striker Luis Suarez has been suspended from all football-related activity for four months for biting Italy defender Giorgio Chiellini.
In addition, the Liverpool player, 27, has been banned for nine international matches, ruling him out of the rest of the 2014 Fifa World Cup.
He will also miss the first nine games of the Premier League season.
Uruguay say they will appeal, calling it an ""excessive decision"" for which ""there was not enough evidence"".
Uruguay Football Association president Wilmar Valdez added: ""I have seen more aggressive incidents recently.
""It is a severe punishment. I don't know exactly which arguments they used but it is a tough punishment for Suarez.""
The player has also been fined 100,000 Swiss francs (£65,680) for the incident, which occurred on Tuesday as Uruguay beat Italy 1-0to finish second in group D and qualify for the last 16 in Brazil.
The ban is the biggest in World Cup history, beating the eight games given to Italy's Mauro Tassotti for elbowing Spain's Luis Enrique in 1994.
""Such behaviour cannot be tolerated on any football pitch and, in particular, not at a Fifa World Cup when the eyes of millions of people are on the stars on the field,"" Claudio Sulser, chairman of the Fifa disciplinary committee, said in a statement.
Suarez has now been found guilty of biting three opponents in his career, and former Liverpool defender Mark Lawrenson felt the suspension should have been longer.
""Say my boy was about 11 or 12, how do you explain to your lad who's a football fan exactly what Luis Suarez keeps doing?"" he told BBC Sport.
""He is now a persistent offender and I thought actually the ban would have been much harsher.""
Suarez was banned for 10 games for biting Chelsea's Branislav Ivanovic during a Premier League match in 2013 and was also suspended for seven games for biting PSV Eindhoven's Otman Bakkal while playing for Ajax in 2010.
Mexican referee Marco Rodriquez did not see Suarez bite Chiellini on the left shoulder, but Fifa ordered an inquiry after the match following protests by the Italian.
Suarez tried to dismiss the incident, telling Uruguayan television: ""These are just things that happen out on the pitch. It was just the two of us inside the area and he bumped into me with his shoulder.""
Suarez's first match back for Liverpool could be in round four of the Capital One Cup, should the Reds win their first game after entering the tournament in the third round, with matches due to take place in the week commencing 27 October.
Reds chief executive Ian Ayre said: ""Liverpool Football Club will wait until we have seen and had time to review the Fifa disciplinary committee report before making any further comment.""
Under the terms of the ban, Suarez cannot train with Liverpool and is prohibited from entering the confines of any stadium during his suspension.
But Liverpool would not be prevented from selling him this summer should they decide to.
He has already been linked with moves to Real Madrid and Barcelona.
Sponsor Adidas said it ""fully supports Fifa's decision"" and will not use Suarez for any more marketing purposes during the World Cup.
""We will again be reminding him of the high standards we expect from our players,"" added the company. ""We will discuss all aspects of our future partnership directly with Suarez and his team.""","Luis_Su%C3%A1rez (occ: 11.0 conf: 0.7560545454545454):
C: 1987 births, Living people, People from Salto, Uruguay, Uruguayan footballers, Association football forwards, 2010 FIFA World Cup players, 2011 Copa América players, 2011 controversies, Footballers at the 2012 Summer Olympics, 2013 FIFA Confederations Cup players, 2014 controversies, 2014 FIFA World Cup players, Copa América-winning players, Club Nacional de Football players, FC Groningen players, AFC Ajax players, Liverpool F.C. players, FC Barcelona players, Uruguayan Primera División players, Eredivisie players, Premier League players, Expatriate footballers in the Netherlands, Expatriate footballers in the United Kingdom, Expatriate footballers in England, Expatriate footballers in Spain, First Division/Premier League top scorers, Olympic footballers of Uruguay, Uruguay youth international footballers, Uruguay international footballers, Uruguayan expatriate footballers, Uruguayan expatriates in the Netherlands, Uruguayan expatriates in England, Uruguayan expatriates in Spain, Uruguay under-20 international footballers, Race-related controversies in the United Kingdom, Violence in sports
T: SoccerPlayer, Athlete, Person, Agent

Uruguay (occ: 6.0 conf: 0.8083):
C: Uruguay, Former Spanish colonies, Liberal democracies, Countries in South America, Spanish-speaking countries and territories, States and territories established in 1825, Member states of Mercosur, Member states of the Union of South American Nations, Member states of the United Nations
T: Country, PopulatedPlace, Place, Location

Liverpool_F.C. (occ: 6.0 conf: 0.8475999999999999):
C: 1892 establishments in England, Association football clubs established in 1892, Football clubs in England, Football League Cup winners, Former Football League clubs, FA Cup winners, G-14 clubs, Liverpool F.C., Multi-sport clubs in the United Kingdom, Premier League clubs
T: SoccerClub, SportsTeam, Organisation, Agent

Cap_%28sport%29 (occ: 5.0 conf: 0.68336):
C: Sports terminology, Association football terminology, Association football records and statistics, Caps

Association_football (occ: 4.0 conf: 0.6087):
C: Association football, Association football terminology, Ball games, Football codes, Laws of association football, Sports originating in England, Physical education, Summer Olympic sports, Articles containing video clips
T: Sport, Activity

FIFA_World_Cup (occ: 4.0 conf: 0.68285):
C: FIFA World Cup, FIFA competitions, World championships, Recurring sporting events established in 1930, Quadrennial sporting events

Italy (occ: 3.0 conf: 0.7626333333333334):
C: Italy, Countries in Europe, G7 nations, G8 nations, G20 nations, Italian-speaking countries and territories, Liberal democracies, Member states of NATO, Member states of the Council of Europe, Member states of the European Union, Member states of the Union for the Mediterranean, Member states of the United Nations, Republics, Romance countries and territories, Southern Europe, States and territories established in 1861
T: Country, PopulatedPlace, Place, Location

Forward_%28association_football%29 (occ: 2.0 conf: 0.8199):
C: Association football forwards, Association football positions, Association football terminology

Defender_%28association_football%29 (occ: 2.0 conf: 0.7914):
C: Association football defenders, Association football positions, Association football terminology

Giorgio_Chiellini (occ: 2.0 conf: 0.7961):
C: 1984 births, A.S. Livorno Calcio players, ACF Fiorentina players, Association football fullbacks, Association football central defenders, Footballers at the 2004 Summer Olympics, Italian footballers, Italy youth international footballers, Italy under-21 international footballers, Italy international footballers, Juventus F.C. players, Living people, Olympic bronze medalists for Italy, Olympic footballers of Italy, People from Pisa, Serie A players, Serie B players, University of Turin alumni, Medalists at the 2004 Summer Olympics, UEFA Euro 2008 players, 2009 FIFA Confederations Cup players, 2010 FIFA World Cup players, UEFA Euro 2012 players, Olympic medalists in football, 2013 FIFA Confederations Cup players, 2014 FIFA World Cup players
T: SoccerPlayer, Athlete, Person, Agent

Premier_League (occ: 2.0 conf: 0.81865):
C: Premier League, Football leagues in England, Top level football leagues in Europe, 1992 establishments in England, Sports leagues established in 1992, Professional sports leagues in the United Kingdom
T: SoccerLeague, SportsLeague, Organisation, Agent

FIFA_Disciplinary_Code (occ: 2.0 conf: 0.76125):
C: Laws of association football, FIFA

La_Liga (occ: 2.0 conf: 0.6614):
C: La Liga, Football leagues in Spain, Top level football leagues in Europe, 1928 establishments in Spain, Sports leagues established in 1928, Atlético de Kolkata owners
T: SoccerLeague, SportsLeague, Organisation, Agent

FIFA (occ: 2.0 conf: 0.72895):
C: FIFA, Association football governing bodies, International sports federations, IOC-recognised international federations, International sports bodies based in Switzerland, Organisations based in Zürich, Sports organisations established in 1904
T: Organisation, Agent

Italy_national_football_team (occ: 1.0 conf: 0.8159):
C: Italy national football team, European national association football teams, FIFA World Cup-winning countries, UEFA European Championship-winning countries, Laureus World Sports Awards winners
T: SoccerClub, SportsTeam, Organisation, Agent

2014_FIFA_World_Cup (occ: 1.0 conf: 0.9018):
C: 2014 FIFA World Cup, 2014 in association football, 2014 in Brazilian football, FIFA World Cup tournaments, International association football competitions hosted by Brazil
T: SoccerTournament, Tournament, SportsEvent, SocietalEvent, Event

Football_League_First_Division (occ: 1.0 conf: 0.6682):
C: Defunct Football League divisions, Football League First Division, Defunct top level football leagues in Europe, Defunct second level football leagues in Europe
T: SoccerLeague, SportsLeague, Organisation, Agent

The_Football_Association (occ: 1.0 conf: 0.6473):
C: The Football Association, 1863 establishments in England, Football governing bodies in England, Futsal in England, Sports organisations established in 1863, Sports governing bodies in England, UEFA member associations, Wembley Stadium and Wembley Arena

Wilmar_Valdez (occ: 1.0 conf: 0.8758):
C: 1965 births, Living people, Football people in Uruguay, People from Canelones Department, Presidents of CONMEBOL

Single-elimination_tournament (occ: 1.0 conf: 0.6241):
C: Tournament systems

Brazil (occ: 1.0 conf: 0.8603):
C: Brazil, Countries in South America, Federal constitutional republics, Former Portuguese colonies, G15 nations, G20 nations, Liberal democracies, Member states of Mercosur, Member states of the Community of Portuguese Language Countries, Member states of the Union of South American Nations, Member states of the United Nations, Portuguese-speaking countries and territories, Romance countries and territories, States and territories established in 1822, BRICS nations, E7 nations
T: Country, PopulatedPlace, Place, Location

Mauro_Tassotti (occ: 1.0 conf: 0.902):
C: 1960 births, Living people, Sportspeople from Rome, Italian footballers, Association football defenders, Serie A players, Serie B players, S.S. Lazio players, A.C. Milan players, Italy international footballers, 1994 FIFA World Cup players, Footballers at the 1988 Summer Olympics, Olympic footballers of Italy, Italian football managers
T: SoccerManager, SportsManager, Person, Agent

Spain_national_football_team (occ: 1.0 conf: 0.8224):
C: Spain national football team, European national association football teams, National sports teams of Spain, UEFA European Championship-winning countries, FIFA World Cup-winning countries
T: SoccerClub, SportsTeam, Organisation, Agent

Luis_Enrique_%28footballer%29 (occ: 1.0 conf: 0.8572):
C: 1970 births, Living people, Sportspeople from Gijón, Spanish footballers, Asturian footballers, Association football midfielders, Association football forwards, Association football utility players, La Liga players, Segunda División B players, Tercera División players, Sporting de Gijón B players, Sporting de Gijón players, Real Madrid C.F. players, FC Barcelona players, Spain under-21 international footballers, Spain under-23 international footballers, Spain international footballers, 1994 FIFA World Cup players, UEFA Euro 1996 players, 1998 FIFA World Cup players, 2002 FIFA World Cup players, Footballers at the 1992 Summer Olympics, Olympic footballers of Spain, Olympic gold medalists for Spain, Olympic medalists in football, FIFA 100, Spanish football managers, La Liga managers, Segunda División managers, FC Barcelona B managers, Celta de Vigo managers, FC Barcelona managers, Serie A managers, A.S. Roma managers, UEFA Champions League winning managers, Spanish expatriate football managers, Expatriate football managers in Italy, Spanish expatriates in Italy
T: SoccerManager, SportsManager, Person, Agent

Claudio_Sulser (occ: 1.0 conf: 0.8851):
C: 1955 births, Living people, Swiss footballers, Switzerland international footballers, Association football forwards, Grasshopper Club Zürich players, People from Lugano
T: SoccerPlayer, Athlete, Person, Agent

Mark_Lawrenson (occ: 1.0 conf: 0.889):
C: 1957 births, Living people, American Soccer League (1988–89) players, British association football commentators, English footballers, Republic of Ireland association footballers, Republic of Ireland international footballers, Preston North End F.C. players, Brighton & Hove Albion F.C. players, Liverpool F.C. players, Barnet F.C. players, The Football League players, National League (English football) players, Republic of Ireland football managers, Tampa Bay Rowdies (1975–93) players, Oxford United F.C. managers, Peterborough United F.C. managers, Newcastle United F.C. non-playing staff, People from Penwortham, English people of Irish descent, BBC sports presenters and reporters
T: SoccerManager, SportsManager, Person, Agent

BBC_Sport (occ: 1.0 conf: 0.8551):
C: BBC Sport, Sports radio in the United Kingdom, Sports television in the United Kingdom
T: Company, Organisation, Agent

Chelsea_F.C. (occ: 1.0 conf: 0.8545):
C: Football clubs in England, Chelsea F.C., Association football clubs established in 1905, Premier League clubs, Former Football League clubs, FA Cup winners, Football League Cup winners, Edwardian era, Football clubs in London, 1905 establishments in England, Fulham
T: SoccerClub, SportsTeam, Organisation, Agent

Branislav_Ivanovi%C4%87 (occ: 1.0 conf: 0.9107):
C: 1984 births, Living people, People from Sremska Mitrovica, Association football defenders, Association football utility players, Serbian footballers, Serbia and Montenegro international footballers, Serbia international footballers, Serbian expatriate footballers, Serbian expatriates in Russia, Serbian expatriates in England, Expatriate footballers in Russia, Expatriate footballers in England, FK Srem players, OFK Beograd players, FC Lokomotiv Moscow players, Chelsea F.C. players, Russian Football Premier League players, Premier League players, 2010 FIFA World Cup players, Serbia under-21 international footballers
T: SoccerPlayer, Athlete, Person, Agent

PSV_Eindhoven (occ: 1.0 conf: 0.9297):
C: Association football clubs established in 1913, Football clubs in the Netherlands, Football clubs in Eindhoven, Philips, PSV Eindhoven, Multi-sport clubs in the Netherlands, G-14 clubs, 1913 establishments in the Netherlands
T: SoccerClub, SportsTeam, Organisation, Agent

Otman_Bakkal (occ: 1.0 conf: 0.9102):
C: 1985 births, Dutch footballers, PSV Eindhoven players, FC Twente players, FC Eindhoven players, Feyenoord players, FC Den Bosch players, FC Dynamo Moscow players, Dutch people of Moroccan descent, Living people, Sportspeople from Eindhoven, Eredivisie players, Eerste Divisie players, Russian Football Premier League players, Footballers at the 2008 Summer Olympics, Olympic footballers of the Netherlands, Netherlands international footballers, Dutch expatriate footballers, Expatriate footballers in Russia
T: SoccerPlayer, Athlete, Person, Agent

AFC_Ajax (occ: 1.0 conf: 0.8693):
C: AFC Ajax, 1900 establishments in the Netherlands, Association football clubs established in 1900, Football clubs in Amsterdam, Football clubs in the Netherlands, G-14 clubs
T: SoccerClub, SportsTeam, Organisation, Agent

Mexico (occ: 1.0 conf: 0.7139):
C: Mexico, Federal constitutional republics, Former Spanish colonies, G15 nations, Liberal democracies, Member states of the United Nations, Romance countries and territories, States and territories established in 1813, G20 nations, E7 nations
T: Country, PopulatedPlace, Place, Location

Referee_%28association_football%29 (occ: 1.0 conf: 0.7012):
C: Laws of association football, Association football referees, Sports officiating

Just_the_Two_of_Us_%28TV_series%29 (occ: 1.0 conf: 0.8336):
C: BBC Television programmes, British reality television series, Singing competitions, 2006 British television programme debuts, 2007 British television programme endings, 2000s British television series
T: TelevisionShow, Work

EFL_Cup (occ: 1.0 conf: 0.849):

Ian_Ayre (occ: 1.0 conf: 0.8668):
C: Living people, People from Liverpool, Royal Navy personnel, British sports executives and administrators, Huddersfield Town A.F.C. non-playing staff, Liverpool F.C. chairmen and investors, Liverpool F.C. non-playing staff, 1964 births
T: Person, Agent

Real_Madrid_C.F. (occ: 1.0 conf: 0.9149):
C: Real Madrid C.F., La Liga clubs, Football clubs in Madrid, Football clubs in Spain, Copa del Rey winners, G-14 clubs, Multi-sport clubs in Spain, Unrelegated association football clubs, Organisations based in Spain with royal patronage, Association football clubs established in 1902, 1902 establishments in Spain
T: SoccerClub, SportsTeam, Organisation, Agent

FC_Barcelona (occ: 1.0 conf: 0.8532):
C: FC Barcelona, La Liga clubs, Football clubs in Barcelona, Football clubs in Catalonia, Football clubs in Spain, Copa del Rey winners, G-14 clubs, Catalan symbols, Unrelegated association football clubs, Association football clubs established in 1899, 1899 establishments in Spain
T: SoccerClub, SportsTeam, Organisation, Agent

Adidas (occ: 1.0 conf: 0.8632):
C: Adidas, Adidas brands, Clothing retailers of Germany, Clothing brands of Germany, Companies established in 1924, Companies based in Bavaria, German brands, Herzogenaurach, Multinational companies headquartered in Germany, Athletic shoe brands, Shoe companies of Germany, Sporting goods manufacturers of Germany, Sportswear brands, Swimwear manufacturers, Companies listed on the Pink Sheets, 1980s fashion, 1990s fashion, 2000s fashion, 2010s fashion
T: Company, Organisation, Agent

","123"
